<?xml version="1.0" encoding="UTF-8"?>

<books xmlns:xsi="http://www.w3.org/2001/XMLSchema-instance"
       xsi:noNamespaceSchemaLocation="Lab-3.xsd">

    <book isbn="ISBN-001">

        <name>Database Management System</name>

        <author>
            <firstname>Abraham</firstname>
            <middlename>J.</middlename>
            <lastname>Silberschatz</lastname>
        </author>

        <author>
            <firstname>Henry</firstname>
            <middlename>F.</middlename>
            <lastname>Korth</lastname>
        </author>

        <pageno>650</pageno>
        <price>900</price>

    </book>
</books>
